{
  "schema_version": "vista.playable-animation-profile/v1",
  "profile_id": "ue_5_7_3_animation_v1",
  "profile_revision": "t12_source_inventory_r1",
  "engine": {
    "name": "Unreal Engine",
    "version": "5.7.3",
    "platform": "Linux",
    "project_owned_root": "/Game/VISTA/Animations/V1"
  },
  "provenance": {
    "source_repository": "SimWorld-AI/SimWorld-Studio",
    "source_dataset_revision": "26bdd2ca18f06ab455023b0a602ede60b3afb243",
    "source_archive_name": "SimWorld-Studio-Minimal.tar.gz",
    "source_archive_sha256": "806e869ad1c65b298f05a39854b28e4188bb50817f539744451849e054990e2f",
    "source_archive_size_bytes": 15170703068,
    "source_project_name": "gym_citynav",
    "source_project_patch": "51426e97354477dca1635217455e644e9ca98976",
    "source_engine_version": "5.3.2",
    "raw_payload_policy": "external_only_never_git",
    "legacy_profile_is_current_evidence": false
  },
  "source_assets": [
    {"source_asset_id":"manny_mesh","semantic_role":"skeletal_mesh","source_object_path":"/Game/Characters/Mannequins/Meshes/SKM_Manny.SKM_Manny","expected_class":"/Script/Engine.SkeletalMesh","source_file_sha256":"f1df1a6b3db170cd80f14c40653fbc9a692af00f7abd575872d9cd8a707e05c6","source_size_bytes":34534883,"source_engine_version":"5.3.2","license_id":"Epic-Content-License","license_status":"verified_for_unreal_project","inventory_state":"filename_digest_verified"},
    {"source_asset_id":"manny_anim_blueprint","semantic_role":"anim_blueprint","source_object_path":"/Game/Characters/Mannequins/Animations/ABP_Manny.ABP_Manny_C","expected_class":"/Script/Engine.AnimBlueprintGeneratedClass","source_file_sha256":"698ad59b091eadff740a7ed78bb18cfad875fa3143d2ae614e0317d5e9680a79","source_size_bytes":368180,"source_engine_version":"5.3.2","license_id":"Epic-Content-License","license_status":"verified_for_unreal_project","inventory_state":"filename_digest_verified"},
    {"source_asset_id":"manny_ik_rig","semantic_role":"ik_rig","source_object_path":"/Game/Characters/Mannequins/Rigs/IK_Mannequin.IK_Mannequin","expected_class":"/Script/IKRig.IKRigDefinition","source_file_sha256":"edd623de3bde5afa06348d226eb98ba4f7d66c962ad7c93b4d25feef5de4b124","source_size_bytes":143479,"source_engine_version":"5.3.2","license_id":"Epic-Content-License","license_status":"verified_for_unreal_project","inventory_state":"filename_digest_verified"},
    {"source_asset_id":"manny_control_rig","semantic_role":"control_rig","source_object_path":"/Game/Characters/Mannequins/Rigs/CR_Mannequin_BasicFootIK.CR_Mannequin_BasicFootIK","expected_class":"/Script/ControlRigDeveloper.ControlRigBlueprint","source_file_sha256":"968ba2fa8bf2bca36556b5623b895b9ac9db162f9c2936acda0b0504239543b4","source_size_bytes":580522,"source_engine_version":"5.3.2","license_id":"Epic-Content-License","license_status":"verified_for_unreal_project","inventory_state":"filename_digest_verified"},
    {"source_asset_id":"manny_idle","semantic_role":"idle_sequence","source_object_path":"/Game/Characters/Mannequins/Animations/Manny/MM_Idle.MM_Idle","expected_class":"/Script/Engine.AnimSequence","source_file_sha256":"3d03e57ab6829b8f60cf19ba1ee5e0ac82e37e5429427edaad472fb473f71d1c","source_size_bytes":897634,"source_engine_version":"5.3.2","license_id":"Epic-Content-License","license_status":"verified_for_unreal_project","inventory_state":"filename_digest_verified"},
    {"source_asset_id":"manny_walk","semantic_role":"walk_sequence","source_object_path":"/Game/Characters/Mannequins/Animations/Manny/MM_Walk_Fwd.MM_Walk_Fwd","expected_class":"/Script/Engine.AnimSequence","source_file_sha256":"226e6affa1682ddf630a2e7759bc8b08dae033490a0449400af18a97941440c4","source_size_bytes":382783,"source_engine_version":"5.3.2","license_id":"Epic-Content-License","license_status":"verified_for_unreal_project","inventory_state":"filename_digest_verified"},
    {"source_asset_id":"manny_run","semantic_role":"run_sequence","source_object_path":"/Game/Characters/Mannequins/Animations/Manny/MM_Run_Fwd.MM_Run_Fwd","expected_class":"/Script/Engine.AnimSequence","source_file_sha256":"aff51ddb72b98d9cd2f4c1351f132dfcfde83d905f4f37d1f35b793b26c95b96","source_size_bytes":293237,"source_engine_version":"5.3.2","license_id":"Epic-Content-License","license_status":"verified_for_unreal_project","inventory_state":"filename_digest_verified"},
    {"source_asset_id":"manny_walk_run","semantic_role":"locomotion_blendspace","source_object_path":"/Game/Characters/Mannequins/Animations/Manny/BS_MM_WalkRun.BS_MM_WalkRun","expected_class":"/Script/Engine.BlendSpace","source_file_sha256":"17534cfadb0ecbfec9556f6b116d3cc4276b2d8ea5b451062ba3919c5ce24a6c","source_size_bytes":8993,"source_engine_version":"5.3.2","license_id":"Epic-Content-License","license_status":"verified_for_unreal_project","inventory_state":"filename_digest_verified"},
    {"source_asset_id":"manny_fall","semantic_role":"fall_reference","source_object_path":"/Game/Characters/Mannequins/Animations/Manny/MM_Fall_Loop.MM_Fall_Loop","expected_class":"/Script/Engine.AnimSequence","source_file_sha256":"732b4cb73137a34d510f774b0ab63934bf2ee5532b0333d401fa450f88e44010","source_size_bytes":698209,"source_engine_version":"5.3.2","license_id":"Epic-Content-License","license_status":"verified_for_unreal_project","inventory_state":"filename_digest_verified"},
    {"source_asset_id":"manny_land","semantic_role":"recover_reference","source_object_path":"/Game/Characters/Mannequins/Animations/Manny/MM_Land.MM_Land","expected_class":"/Script/Engine.AnimSequence","source_file_sha256":"24f34cf736992c09b7502185c3d71ef1c79278fb558dacc91fa494ecfe452fe5","source_size_bytes":300335,"source_engine_version":"5.3.2","license_id":"Epic-Content-License","license_status":"verified_for_unreal_project","inventory_state":"filename_digest_verified"},
    {"source_asset_id":"human_pickup","semantic_role":"pickup_reference","source_object_path":"/Game/Human_Avatar/DefaultCharacter/Animation/PickUp/Lifting_UE_Montage.Lifting_UE_Montage","expected_class":"/Script/Engine.AnimMontage","source_file_sha256":"c75ef22f8ad0f8a3f6ea0ff052d04e38fdf1b44dade48aa7d60d7a54ab286de4","source_size_bytes":14763,"source_engine_version":"5.3.2","license_id":"SimWorld-Source-License-Review-Required","license_status":"review_required","inventory_state":"filename_digest_verified"},
    {"source_asset_id":"human_pause","semantic_role":"pause_reference","source_object_path":"/Game/Human_Avatar/Animation/LiftSet/Lightweight/01/R/A_Lift_Light_Idle_01_R_Montage.A_Lift_Light_Idle_01_R_Montage","expected_class":"/Script/Engine.AnimMontage","source_file_sha256":"744a4975a53429ca5c33a51514542581f517710785cbb534613d85045fe54c2d","source_size_bytes":9304,"source_engine_version":"5.3.2","license_id":"SimWorld-Source-License-Review-Required","license_status":"review_required","inventory_state":"filename_digest_verified"},
    {"source_asset_id":"human_look","semantic_role":"look_at_reference","source_object_path":"/Game/Human_Avatar/Animation/LiftSet/Lightweight/01/R/A_Lift_Light_Look_Center_01_R.A_Lift_Light_Look_Center_01_R","expected_class":"/Script/Engine.AnimSequence","source_file_sha256":"25f1fd1b4a7488a1bc0ba472621f4ad59e8afea5e8e5a2150c14a4b656defba4","source_size_bytes":120268,"source_engine_version":"5.3.2","license_id":"SimWorld-Source-License-Review-Required","license_status":"review_required","inventory_state":"filename_digest_verified"},
    {"source_asset_id":"human_pickup_50cm","semantic_role":"pickup_50cm_reference","source_object_path":"/Game/Human_Avatar/Animation/LiftSet/Lightweight/01/R/A_Lift_Light_PickUp_50cm_01_R_Montage.A_Lift_Light_PickUp_50cm_01_R_Montage","expected_class":"/Script/Engine.AnimMontage","source_file_sha256":"fc201992518837aaa55f648efbdaf72d6695b1d1c20df1d745e63c7947671c0d","source_size_bytes":14669,"source_engine_version":"5.3.2","license_id":"SimWorld-Source-License-Review-Required","license_status":"review_required","inventory_state":"filename_digest_verified"},
    {"source_asset_id":"human_put_aside_50cm","semantic_role":"drop_50cm_reference","source_object_path":"/Game/Human_Avatar/Animation/LiftSet/Lightweight/01/R/A_Lift_Light_PutAside_50cm_01_R_Montage.A_Lift_Light_PutAside_50cm_01_R_Montage","expected_class":"/Script/Engine.AnimMontage","source_file_sha256":"10f97d426236121e9437227c3ca7837b2de02ff81d73c399c07b05835b827fc3","source_size_bytes":9055,"source_engine_version":"5.3.2","license_id":"SimWorld-Source-License-Review-Required","license_status":"review_required","inventory_state":"filename_digest_verified"},
    {"source_asset_id":"human_wave","semantic_role":"door_reach_candidate","source_object_path":"/Game/Human_Avatar/DefaultCharacter/Animation/Actions/HandWaving/Waving_1_UE_Montage.Waving_1_UE_Montage","expected_class":"/Script/Engine.AnimMontage","source_file_sha256":"f788dc2880e1e983096fd1ce7c0693546644400514198ba220cbe9a5042fc352","source_size_bytes":9177,"source_engine_version":"5.3.2","license_id":"SimWorld-Source-License-Review-Required","license_status":"review_required","inventory_state":"filename_digest_verified"}
  ],
  "authored_assets": [
    {"asset_id":"pawn_class","role":"pawn_class","object_path":"/Game/VISTA/Animations/V1/Character/BP_VistaAnimationCharacter.BP_VistaAnimationCharacter_C","expected_class":"/Script/Engine.BlueprintGeneratedClass","source_asset_ids":["manny_mesh","manny_anim_blueprint"],"authoring_recipe":"author_blueprint","authoring_state":"recipe_ready","required_live_checks":["generated_class_match","pawn_spawnable","skeletal_mesh_binding","anim_blueprint_binding"]},
    {"asset_id":"skeletal_mesh","role":"skeletal_mesh","object_path":"/Game/VISTA/Animations/V1/Character/SK_VistaManny.SK_VistaManny","expected_class":"/Script/Engine.SkeletalMesh","source_asset_ids":["manny_mesh"],"authoring_recipe":"duplicate_and_rebind","authoring_state":"recipe_ready","required_live_checks":["class_match","skeleton_binding","package_digest"]},